EECS 471 - Applied Parallel Programming with GPUs,parallelism programming models CUDA mapping computations parallel hardware
EECS 471 - Applied Parallel Programming with GPUs,efficient data structures paradigms efficient parallel algorithms
EECS 471 - Applied Parallel Programming with GPUs,Applied Parallel Programming GPUs graphics processing unit
EECS 473 - Advanced Embedded Systems,Design hardware software modern embedded systems
EECS 473 - Advanced Embedded Systems,Real time operating systems Device drivers general operating systems OS
EECS 473 - Advanced Embedded Systems,PCB design power integrity electromagnetic interference
EECS 473 - Advanced Embedded Systems,Radio frequency wireless communication Low power design DC converter design PCBs
EECS 473 - Advanced Embedded Systems,Rapid prototyping embedded systems complete advanced embedded system
EECS 475 - Introduction to Cryptography,Cryptography building secure computing communication systems cryptographic applications
EECS 475 - Introduction to Cryptography,algorithms encryption schemes protocols
EECS 475 - Introduction to Cryptography,symmetric private key encryption public key encryption hash functions digital signatures key distribution
EECS 475 - Introduction to Cryptography,core scientific principles cryptography build secure software communication systems
EECS 475 - Introduction to Cryptography,privacy security authenticity data communications
EECS 477 - Introduction to  Algorithms,Fundamental techniques designing effi cient algorithms basic mathematical methods analyzing performance
EECS 477 - Introduction to  Algorithms,Paradigms algorithm design divide conquer greedy methods graph search techniques dynamic programming
EECS 477 - Introduction to  Algorithms,Design efficient data structures analysis 
EECS 477 - Introduction to  Algorithms,running time space requirements algorithms worst average cases
EECS 477 - Introduction to  Algorithms,algorithms computer science introduction cs
EECS 481 - Software Engineering,software engineering project group
EECS 482 - Introduction to Operating Systems,Operating system design implementation OS implemtnation computers
EECS 482 - Introduction to Operating Systems,multi-tasking concurrency synchronization inter process communication deadlock scheduling
EECS 482 - Introduction to Operating Systems,resource allocation memory storage management input output file systems protection security
EECS 482 - Introduction to Operating Systems,concurrency synchronization multi task environment
EECS 482 - Introduction to Operating Systems,file systems memory management
EECS 483 - Compiler Construction,compiling techniques parsing algorithms
EECS 483 - Compiler Construction,semantic processing optimization
EECS 483 - Compiler Construction,compiler construction substantial programming language compiler generating system
EECS 484 - Database Management Systems,design creation query management large enterprise databases
EECS 484 - Database Management Systems,database management systems Query languages SQL forms embedded SQL
EECS 484 - Database Management Systems,Database design integrity normalization access methods query optimization transaction management concurrency control recovery
EECS 485 - Web Systems,web systems applications internet scale distributed systems
EECS 485 - Web Systems,client server protocols security information retrieval search engines scalable data processing fault tolerant systems
EECS 485 - Web Systems,web applications web systems
EECS 487 - Introduction to Natural Language Processing,natural language processing NLP linguistics
EECS 487 - Introduction to Natural Language Processing,syntax parsing lexical semantics compositional semantics
EECS 487 - Introduction to Natural Language Processing,discourse analysis information extraction sentiment analysis question answering summarization dialogue systems machine translation text generation
EECS 489 - Computer Networks,Protocols architectures computer networks
EECS 489 - Computer Networks,client server computing socket programming
EECS 489 - Computer Networks,protocol design principles flow congestion control
EECS 489 - Computer Networks,design choices actual implementation issues
EECS 490 - Programming Languages,Fundamental concepts programming languages writing programming languages
EECS 490 - Programming Languages,functional imperative object oriented logic programming languages
EECS 490 - Programming Languages,control flow memory management concurrency modularity
EECS 490 - Programming Languages,methodologies techniques tools writing correct maintainable programs
EECS 491 - Introduction to Distributed Systems,Distributed systems
EECS 491 - Introduction to Distributed Systems,abstractions simplifying development distributed systems
EECS 492 - Introduction to Artificial Intelligence,core concepts AI Artificial Intelligence
EECS 492 - Introduction to Artificial Intelligence,building computational agents
EECS 492 - Introduction to Artificial Intelligence,search logic knowledge representation reasoning planning decision making uncertainty machine learning
EECS 494 - Computer Game Design and Development,design development computer games video games game design
EECS 494 - Computer Game Design and Development,history games 2D graphics animation sprites 3D
EECS 494 - Computer Game Design and Development,binary space partition trees software engineering game design interactive fiction user interfaces
EECS 494 - Computer Game Design and Development,artificial intelligence game SDK networking multiplayer games game development environments commercialization software
EECS 495 - Software Development for Accessibility,large complex software systems software development methodology
EECS 495 - Software Development for Accessibility,dealing with disability illness accessibility
EECS 495 - Software Development for Accessibility,disabled clients team based software systems development
EECS 496 - Major Design Experience-Professionalism,Design principles multidisciplinary team projects
EECS 496 - Major Design Experience-Professionalism,team strategies entrepreneurial skills ethics social environmental awareness
EECS 496 - Major Design Experience-Professionalism,major design experience professionalism professionals
EECS 497 - Human-Centered Software Design and Development,Team based user centered design development complex software systems
EECS 497 - Human-Centered Software Design and Development,effective design strategies project management methodologies
EECS 497 - Human-Centered Software Design and Development,customer discovery contextual inquiry prototyping process models creative problem solving inclusive thinking team dynamics social concerns testing strategies
EECS 497 - Human-Centered Software Design and Development,projects teams software design development human centered
EECS 498 - Special Topics,Intelligent Programming Systems Advanced Operating Systems Projects Extended Reality Society Machine Learning Basics Optics Photonics Power Electronics Reinforcement Learning
EECS 499 - Advanced Directed Study,substantial research problems EECS special interest design problems
EECS 499 - Advanced Directed Study,research advancded directed study professors
EECS 501 - Probability and Random Processes,probability random processes
EECS 501 - Probability and Random Processes,probability axioms sigma algebras random vectors expectation probability distributions densities
EECS 501 - Probability and Random Processes,Poisson Wiener processes stationary processes autocorrelation spectral density effects filtering linear least squares estimation convergence random sequences
EECS 507 - Introduction to Embedded System Research,research related to embedded system analysis design synthesis
EECS 507 - Introduction to Embedded System Research,fundamental embedded systems topics
EECS 517 - Proc Plasma,Plasma physics electrical gas discharges material processing physics plasma proc
EECS 517 - Proc Plasma,Gas kinetics atomic collisions transport coefficients drift diffusion sheaths Boltzmann distribution function calculation plasma simulation
EECS 517 - Proc Plasma,plasma diagnostics particle probes spectroscopy electromagnetic waves analysis commonly plasma tools materials processing
EECS 520 - Solid State Physics,Crystal structure Phonons Introduction Quantum Mechanics
EECS 520 - Solid State Physics,Free electron Fermi gas Low dimensional conductor Electronic structure Energy bands Properties semiconductors
EECS 520 - Solid State Physics,Dielectrics response Light absorption emission Magnetic effects Superconductivity
EECS 520 - Solid State Physics,phyiscs solid state gases energy electricity electric
EECS 523 - Digital Integ Tech,Integrated circuit fabrication overview digital integ tech
EECS 523 - Digital Integ Tech,Long channel device I V review short channel MOSFET I V characteristics velocity saturation mobility degradation hot carriers gate depletion
EECS 523 - Digital Integ Tech,MOS device scaling strategies silicon insulator lightly doped drain structures chip interconnect parasitics performance Major CMOS scaling challenges Process circuit simulation
EECS 530 - Electromagnetic Theory I,Maxwells equations constitutive relations boundary conditions
EECS 530 - Electromagnetic Theory I,Potentials representation electromagnetic fields
EECS 530 - Electromagnetic Theory I,Uniqueness duality equivalence reciprocity Babinets theorems Plane cylindrical spherical waves Waveguides elementary antennas
EECS 530 - Electromagnetic Theory I,Electromagnetic theory electrostatics magnetostatics physics
EECS 540 - Applied Quantum Mechanics,nonrelativistic quantum mechanics applied quantum mechanics
EECS 540 - Applied Quantum Mechanics,classical mechanics postulates quantum mechanics operator formalism stationary state problems
EECS 540 - Applied Quantum Mechanics,time evolution approximation methods time independent time dependent interactions electromagnetic interactions scattering
EECS 542 - Advanced Topics in Computer Vision,computer vision
EECS 542 - Advanced Topics in Computer Vision,physics vision geometry motion tracking reconstruction grouping
EECS 542 - Advanced Topics in Computer Vision,segmentation recognition activity scene understanding statistical methods learning systems applications
EECS 544 - Analysis of Societal Networks,societal networks
EECS 544 - Analysis of Societal Networks,graph theory linear algebra probability game theory
EECS 551 - Matrix Methods for Signal Processing Data Analysis and Machine Learning,matrix methods signal processing data analysis machine learning
EECS 551 - Matrix Methods for Signal Processing Data Analysis and Machine Learning,eigenvalue singular value decomposition projection theorem constrained regularized unconstrained least squares techniques iterative algorithms
EECS 551 - Matrix Methods for Signal Processing Data Analysis and Machine Learning,image deblurring ranking of webpages image segmentation compression social networks circuit analysis recommender systems handwritten digit recognition
EECS 553 - Machine Learn (ECE),supervised unsupervised sequential learning linear nonlinear regression logistic regression support vector machines
EECS 553 - Machine Learn (ECE),kernel methods decision trees ensemble methods neural networks deep learning dimension reduction clustering probabilistic models
EECS 553 - Machine Learn (ECE),algorithms derivation fundamental principles machine learn real world data
EECS 554 - Introduction to Digital Communication and Coding,Digital transmission information discrete analog channels
EECS 554 - Introduction to Digital Communication and Coding,Sampling quantization noiseless source codes data compression Huffmans algorithm and entropy block convolutional channel codes error correction channel capacity
EECS 554 - Introduction to Digital Communication and Coding,PSK MSK FSK QAM matched filter receivers
EECS 554 - Introduction to Digital Communication and Coding,power bandwidth data rate error probability
EECS 558 - Stochastic Control,second order properties random processes stochastic control
EECS 558 - Stochastic Control,nonparametric model techniques spectral estimation characterization output statistics nonlinear systems time frequency representations
EECS 558 - Stochastic Control,asymptotic techniques Monte Carlo simulation
EECS 558 - Stochastic Control,speech processing signal extrapolation multidimensional spectral estimation beamforming
EECS 560 - Linear Systems Theory,Linear spaces linear operators systems theory
EECS 560 - Linear Systems Theory,Bases subspaces eigenvalues eigenvectors canonical form
EECS 560 - Linear Systems Theory,causality controllability observability realizations canonical decomposition stability
EECS 561 - Design of Digital Control Systems,Sampling data reconstruction
EECS 561 - Design of Digital Control Systems,Computer simulations laboratory implementation real time control systems
EECS 561 - Design of Digital Control Systems,digital control system discrete time systems state variable descriptions
EECS 563 - Hybrid Systems Analysis and Control,analysis design hybrid systems hybrid control systems
EECS 563 - Hybrid Systems Analysis and Control,Hybrid system modeling formalisms specifications automata theory temporal logics verification barrier certificates reachable sets abstractions methods control synthesis
EECS 563 - Hybrid Systems Analysis and Control,Model predictive control hybrid systems
EECS 564 - Estimation Filtering and Detection,Principles estimation linear filtering detection
EECS 564 - Estimation Filtering and Detection,linear nonlinear minimum mean squared error estimation
EECS 564 - Estimation Filtering and Detection,Linear filtering Wiener Kalman filtering
EECS 564 - Estimation Filtering and Detection,simple composite binary multiple hypotheses
EECS 564 - Estimation Filtering and Detection,Neyman Pearson Bayesian approaches
EECS 574 - Computational Complexity,theory computation complex theory computational complexity
EECS 574 - Computational Complexity,Computatability undecidability logic
EECS 574 - Computational Complexity,Relations between complexity classes NP completeness P completeness randomized computation
EECS 575 - Advanced Cryptography,design cryptosystems cryptanalysis cryptography advanced
EECS 575 - Advanced Cryptography,cryptanalysis classical cryptosystems theoretical analysis functions DES differential cryptanalysis RSA cryptosystem ElGamal elliptic
EECS 575 - Advanced Cryptography,hyperelliptic hidden mononomial cryptosystems attacks signature schemes identification schemes authentication codes secret sharing zero knowledge
EECS 582 - Advanced Operating Systems,operating systems OS
EECS 583 - Advanced Compilers,compilers architectures parallelism memory hierarchy
EECS 582 - Advanced Operating Systems,distributed systems languages networking security protection realtime systems modeling analysis
EECS 584 - Advanced Database Systems,database management systems advanced
EECS 584 - Advanced Database Systems,Distributed databases advanced query optimization query processing transaction processing data models architectures
EECS 587 - Parallel Computing,programs parallel computers computing Grid computing Performance analysis
EECS 587 - Parallel Computing,speedup load balancing latency system taxonomies
EECS 595 - Natural Language Processing,Linguistics fundamentals natural language processing NLP
EECS 595 - Natural Language Processing,speech tagging hidden Markov models syntax parsing lexical semantics compositional semantics word sense disambiguation machine translation
EECS 598 - Special Topics,Intelligent Programming Systems VLSI wireless communication machine learning Theory Network Design Advanced Accessibility Quantum Computing Information Probability Machine Learning Computational Biology Artificial Intelligence Biomedicine Chip Fabrication Verification Causality Machine Learning
EECS 598 - Special Topics,Quantum Computing Systems Architecture Reinforcement Learning Solution Processed Optoelectronics Colloidal Nanomaterials Biomedical Applications Skills Graduate Studies
EECS 599 - Directed Study,Individual study advanced topics electrical engineering computer science
EECS 628 - Advanced High Performance VLSI Design,Advanced issues VLSI design high performance low power reliability
EECS 628 - Advanced High Performance VLSI Design,leakage control high speed chip communication memory design soft error failures noise analysis control error tolerant design circuit families
